title,url,discounted_price,original_price
Car Windshield Anti-fog Agent Rearview Mirror Rain-proof,https://www.cigabuy.com/car-windshield-anti-fog-agent-rearview-mirror-rain-proof-p-17464.html,,
Portable Cleaning Foldable Storage Bucket Camping Supplies Plastic Car Trash Can,https://www.cigabuy.com/portable-cleaning-foldable-storage-bucket-camping-supplies-plastic-car-trash-can-p-19541.html,€5.70,€57.23 
Ultraviolet Sterilization Knife Holder Electric Chopsticks Disinfection Machine,https://www.cigabuy.com/ultraviolet-sterilization-knife-holder-electric-chopsticks-disinfection-machine-p-19551.html,,
Xiaomi Portable Disinfection Water Generator,https://www.cigabuy.com/xiaomi-portable-disinfection-water-generator-p-20147.html,€33.74,€75.60 
SW11 Child Smart Watch GPS Watch Phone Kids Safe Monitor Tracker Pedometer,https://www.cigabuy.com/sw11-child-smart-watch-gps-watch-phone-kids-safe-monitor-tracker-pedometer-p-19724.html,,
Gradient Color Silk Beach Scarf,https://www.cigabuy.com/gradient-color-silk-beach-scarf-p-15590.html,€3.75,€16.69 
Unisex Fashion Bag PU Leather Earphone Hole Waterproof 15.6 inch Laptop Backpack,https://www.cigabuy.com/unisex-fashion-bag-pu-leather-earphone-hole-waterproof-156-inch-laptop-backpack-p-19177.html,€6.32,€42.46 
Mini Portable Home Air Conditioning Humidifier Purifier USB Air Cooler Fan,https://www.cigabuy.com/mini-portable-home-air-conditioning-humidifier-purifier-usb-air-cooler-fan-p-19418.html,€10.96,€41.51 
Cordless Bluetooth Earphone With Bluetooth Speaker Function TWS Earphones,https://www.cigabuy.com/cordless-bluetooth-earphone-with-bluetooth-speaker-function-tws-earphones-p-18721.html,€12.01,€16.98 
Original Stereo earphone Metal handsfree sports Headset Heavy low,https://www.cigabuy.com/original-stereo-earphone-metal-handsfree-sports-headset-heavy-low-p-19749.html,,
HONGBIAO SM Stereo Bass Earphone Headphones Metal Handsfree Headset 3.5mm,https://www.cigabuy.com/hongbiao-sm-stereo-bass-earphone-headphones-metal-handsfree-headset-35mm-p-19794.html,,
Bicycle Shorts Cycling Underwear Thick Silicone Cushion Cycling Biker Shorts,https://www.cigabuy.com/bicycle-shorts-cycling-underwear-thick-silicone-cushion-cycling-biker-shorts-p-19037.html,€4.31,€16.70 
100 x Transparent PVC Gloves Rubber For Home Kitchen Garden Cleaning,https://www.cigabuy.com/100-x-transparent-pvc-gloves-rubber-for-home-kitchen-garden-cleaning-p-18129.html,€4.40,€7.49 
TWS Wireless Bluetooth Earphones Sports Bluethooth Earbuds Ear Head Phones,https://www.cigabuy.com/tws-wireless-bluetooth-earphones-sports-bluethooth-earbuds-ear-head-phones-p-19044.html,€11.33,€28.73 
Xiaomi Mijia Zhirui E27 5W 500LM White LED Globe Light Bulb,https://www.cigabuy.com/xiaomi-mijia-zhirui-e27-5w-500lm-white-led-globe-light-bulb-p-19810.html,,
Electric Soldering Iron Suit Thermostat Electric Iron Set 28 Pieces Thermostat,https://www.cigabuy.com/electric-soldering-iron-suit-thermostat-electric-iron-set-28-pieces-thermostat-p-19246.html,€9.62,€29.91 
Kangaroo Brand Leather Messenger Bag Man Handbag Chest Bag,https://www.cigabuy.com/kangaroo-brand-leather-messenger-bag-man-handbag-chest-bag-p-18783.html,€5.88,€14.08 
Bluetooth 5.0 Headset TWS Wireless Waterproof Sports Single Ear Earphone,https://www.cigabuy.com/bluetooth-50-headset-tws-wireless-waterproof-sports-single-ear-earphone-p-18664.html,€6.73,€6.76 
Detachable Baseball Protective Clear Face mask Cap Anti-Splash Hat,https://www.cigabuy.com/detachable-baseball-protective-clear-face-mask-cap-anti-splash-hat-p-18151.html,€1.40,€2.48 
Baellerry Men Wallet Short Fashion Simple PU Leather Wallet Card Holder,https://www.cigabuy.com/baellerry-men-wallet-short-fashion-simple-pu-leather-wallet-card-holder-p-18474.html,,
Wireless Bluetooth FM Transmitter Hands-Free Car Kit Color Screen MP3 Player,https://www.cigabuy.com/wireless-bluetooth-fm-transmitter-hands-free-car-kit-color-screen-mp3-player-p-19329.html,€9.82,€17.68 
New Zeblaze Hybrid 2 Smartwatch Heart Rate Waterproof Sleep Fitness Tracker,https://www.cigabuy.com/new-zeblaze-hybrid-2-smartwatch-heart-rate-waterproof-sleep-fitness-tracker-p-18654.html,,
Men Anti Theft Chest Bag Shoulder Crossbody Bag School Summer Trip Bag A Left,https://www.cigabuy.com/men-anti-theft-chest-bag-shoulder-crossbody-bag-school-summer-trip-bag-left-p-18832.html,€2.71,€5.42 
Retro Humidification Towers Fan 2-in-1 Spray Desktop USB Humidification Fan,https://www.cigabuy.com/retro-humidification-towers-fan-2-in-1-spray-desktop-usb-humidification-fan-p-18842.html,€9.95,€19.91 
J3 TWS Bluetooth 5.0 Earphone Wireless Touch Control Magnetic Stereo Headset,https://www.cigabuy.com/j3-tws-bluetooth-50-earphone-wireless-touch-control-magnetic-stereo-headset-p-19204.html,€10.96,€19.81 
F1 In Ear/ Earhook Earphones IP5X Waterproof Headphone Super Bass Sport Headset,https://www.cigabuy.com/f1-in-ear-earhook-earphones-ip5x-waterproof-headphone-super-bass-sport-headset-p-19779.html,,
Simplified Package Xiaomi Piston 3rd Edition Earphone Mic,https://www.cigabuy.com/simplified-package-xiaomi-piston-3rd-edition-earphone-mic-p-19820.html,,
Battery Tester Digital Capacity Tester Checker Power Supply Tester,https://www.cigabuy.com/battery-tester-digital-capacity-tester-checker-power-supply-tester-p-18710.html,€3.61,€5.06 
Stainless Steel Cans Opener Professional Ergonomic Manual Can Opener,https://www.cigabuy.com/stainless-steel-cans-opener-professional-ergonomic-manual-can-opener-p-18999.html,€1.61,€8.81 
Auto Paint Pen Color Touch Up White Scratch Repair,https://www.cigabuy.com/auto-paint-pen-color-touch-up-white-scratch-repair-p-17253.html,,
Multi-Function Ratchet Screwdriver Angle Variable 0-180 Degrees,https://www.cigabuy.com/multi-function-ratchet-screwdriver-angle-variable-0-180-degrees-p-19234.html,€1.06,€5.96 
SanDisk A1 16GB UHS-I / Class 10 up to 98MB / s Micro SDHC Memory Card,https://www.cigabuy.com/sandisk-a1-16gb-uhs-class-10-up-to-98mb-s-micro-sdhc-memory-card-p-17561.html,,
Natural Earth Lava Pumice Stone,https://www.cigabuy.com/natural-earth-lava-pumice-stone-p-17169.html,,
WLISTH Multifunctional Men's Quartz Watch Fashion 4 Hands Six Calendar Watch,https://www.cigabuy.com/wlisth-multifunctional-mens-quartz-watch-fashion-4-hands-six-calendar-watch-p-18667.html,,
Xiaomi mijia Yeelight Folding USB Rechargeable LED Table Desk Lamp Dimmable,https://www.cigabuy.com/xiaomi-mijia-yeelight-folding-usb-rechargeable-led-table-desk-lamp-dimmable-p-18916.html,€11.78,€29.51 
USB Computer HD Camera Video Free Drive with Microphone Webcam For PC Laptop,https://www.cigabuy.com/usb-computer-hd-camera-video-free-drive-with-microphone-webcam-for-pc-laptop-p-19003.html,€6.47,€18.37 
"Xiaomi 3D Glasses Virtual Reality Box for 4.7 - 5.7"" Smart Phones",https://www.cigabuy.com/xiaomi-3d-glasses-virtual-reality-box-for-47-57-smart-phones-p-19825.html,,
SKMEI 1251 Chronograph Sports Watch for Men,https://www.cigabuy.com/skmei-1251-chronograph-sports-watch-for-men-p-19792.html,,
USB Eletric Fan Humidifying Hydration Water Spray Fan Portable Folding Fan,https://www.cigabuy.com/usb-eletric-fan-humidifying-hydration-water-spray-fan-portable-folding-fan-p-18911.html,€21.85,€62.71 
Mini Wireless Grinding Machine Variable Speed Rotary Tools Drill Engraver Pen,https://www.cigabuy.com/mini-wireless-grinding-machine-variable-speed-rotary-tools-drill-engraver-pen-p-18782.html,€10.77,€27.67 
Luminous Headset Glow In Dark Headphones Flashlight Earphone with Mic,https://www.cigabuy.com/luminous-headset-glow-in-dark-headphones-flashlight-earphone-with-mic-p-19744.html,,
Electric Mini Hand Drill Rotary Metal Wood Engraver Grinder Polishing Machine,https://www.cigabuy.com/electric-mini-hand-drill-rotary-metal-wood-engraver-grinder-polishing-machine-p-19230.html,€7.93,€35.77 
LED Flashlight 5-Mode COB LED Camping Tent Lamp USB Rechargeable Torch,https://www.cigabuy.com/led-flashlight-5-mode-cob-led-camping-tent-lamp-usb-rechargeable-torch-p-19317.html,€4.01,€15.05 
Vintage Laptop PU Leather Backpacks for School Bags Travel Leisure Retro,https://www.cigabuy.com/vintage-laptop-pu-leather-backpacks-for-school-bags-travel-leisure-retro-p-19183.html,€10.96,€55.21 
Stainless Car Ice Snow Shovel Assistant Cleaning Car Windshield and Window Tools,https://www.cigabuy.com/stainless-car-ice-snow-shovel-assistant-cleaning-car-windshield-and-window-tools-p-17005.html,€0.27,€4.19 
WLISTH Watch Men Trend Of Luminous Waterproof Strip Quartz Watch,https://www.cigabuy.com/wlisth-watch-men-trend-of-luminous-waterproof-strip-quartz-watch-p-18840.html,€10.79,€18.10 
10 x Protective Goggles Fit Over Glasse Prevention of Coronavirus,https://www.cigabuy.com/10-x-protective-goggles-fit-over-glasse-prevention-of-coronavirus-p-18152.html,€4.43,€8.50 
Food Grade Silicone Cupcake Baking Mold Mould Non Stick Muffin Cup Baking Cup,https://www.cigabuy.com/food-grade-silicone-cupcake-baking-mold-mould-non-stick-muffin-cup-baking-cup-p-17054.html,€0.27,€2.87 
Zeblaze VIBE 5 PRO Color Touch Display  IP67 Smart Watch,https://www.cigabuy.com/zeblaze-vibe-5-pro-color-touch-display-ip67-smart-watch-p-19233.html,€33.08,€77.55 
CUENA Men's Women's Watch Casual Sport Quartz Stainless Steel Mesh Band Watch,https://www.cigabuy.com/cuena-mens-womens-watch-casual-sport-quartz-stainless-steel-mesh-band-watch-p-19732.html,,
S36 Earphone Heavy Bass In-Ear Earphones Music Headset Microphone 3.5mm,https://www.cigabuy.com/s36-earphone-heavy-bass-in-ear-earphones-music-headset-microphone-35mm-p-19796.html,,
Xiaomi 4 Ports USB3.0 Hub with Stand-by Power Supply Interface USB Hub,https://www.cigabuy.com/xiaomi-4-ports-usb30-hub-with-stand-by-power-supply-interface-usb-hub-p-19283.html,,
Rocketek CSR 4.0 A2DP Bluetooth Adapter USB Dongle For PC Computer Speaker Audio,https://www.cigabuy.com/rocketek-csr-40-a2dp-bluetooth-adapter-usb-dongle-for-pc-computer-speaker-audio-p-19258.html,€3.82,€7.97 
WLISTH S959 Men's Business Quartz Steel Band Sports Waterproof Watch,https://www.cigabuy.com/wlisth-s959-mens-business-quartz-steel-band-sports-waterproof-watch-p-18665.html,€9.56,€9.56 
2.4GHz Wireless Optical Gaming Mouse for PC DPI Adjustable,https://www.cigabuy.com/24ghz-wireless-optical-gaming-mouse-for-pc-dpi-adjustable-p-19821.html,,
SASTFUE 64GB Class 10 Up to 80MB/s Micro SDXC UHS-I Memory Card,https://www.cigabuy.com/sastfue-64gb-class-10-up-to-80mbs-micro-sdxc-uhs-memory-card-p-14971.html,€6.33,€16.62 
DUBERY Vintage Sunglasses Polarized Men's Sun Glasses For Men,https://www.cigabuy.com/dubery-vintage-sunglasses-polarized-mens-sun-glasses-for-men-p-18476.html,,
Fashion Faux Leather Mens Quarts Watches Waterproof Calendar Wrist Watch,https://www.cigabuy.com/fashion-faux-leather-mens-quarts-watches-waterproof-calendar-wrist-watch-p-19231.html,€4.09,€9.94 
WLtoys A959 High-Speed Vortex 4-CH 1:18 2.4GHz 4WD RC Car,https://www.cigabuy.com/wltoys-a959-high-speed-vortex-4-ch-118-24ghz-4wd-rc-car-p-19755.html,,
Women Slim Sweat Enhancing Waist Training Corset Waist Trainer Belt,https://www.cigabuy.com/women-slim-sweat-enhancing-waist-training-corset-waist-trainer-belt-p-14956.html,€1.26,€11.82 
Men Short Wallets PU Leather Zipper Buckle Coin Purse,https://www.cigabuy.com/men-short-wallets-pu-leather-zipper-buckle-coin-purse-p-19214.html,€2.85,€9.90 
38 PCS/Set Industrial  Stainless Steel Wire Brush 8-19mm Cleaning Brush Kit,https://www.cigabuy.com/38-pcsset-industrial-stainless-steel-wire-brush-8-19mm-cleaning-brush-kit-p-18989.html,€12.95,€62.29 
NAVIFORCE 9038 Men Watches Luxury Sport Quartz 30M Waterproof Auto Date,https://www.cigabuy.com/naviforce-9038-men-watches-luxury-sport-quartz-30m-waterproof-auto-date-p-19199.html,€11.14,€17.20 
X5 Bluetooth 5.0+3.0+2.4G Wireless Three Mode Mute Rechargeable Gaming Mouse,https://www.cigabuy.com/x5-bluetooth-503024g-wireless-three-mode-mute-rechargeable-gaming-mouse-p-19752.html,,
Three-In-One Data Cable Is Suitable For Apple Android Type-C Fast Charging,https://www.cigabuy.com/three-in-one-data-cable-is-suitable-for-apple-android-type-fast-charging-p-19542.html,€6.58,€14.62 
Z2 Bone Conduction Bluetooth Headset Wireless Sports Fitness Hanging Ear,https://www.cigabuy.com/z2-bone-conduction-bluetooth-headset-wireless-sports-fitness-hanging-ear-p-19556.html,,
Cartoon Mini Children Camera Front And Rear Double Digital Small SLR Camera,https://www.cigabuy.com/cartoon-mini-children-camera-front-and-rear-double-digital-small-slr-camera-p-19606.html,€13.77,€40.59 
Fashion Men Backpack Waterproof PU Leather Travel Bag Large Capacity Teenage,https://www.cigabuy.com/fashion-men-backpack-waterproof-pu-leather-travel-bag-large-capacity-teenage-p-19987.html,€6.51,€21.81 
TIMEMORE Chestnut Coffee Grinder Portable Hand Manual Grinder Machine,https://www.cigabuy.com/timemore-chestnut-coffee-grinder-portable-hand-manual-grinder-machine-p-20014.html,€48.95,€107.44 
5pcs Xiaomi Mijia Stainless Steel Nail Clippers Set Trimmer Pedicure Care Clip,https://www.cigabuy.com/5pcs-xiaomi-mijia-stainless-steel-nail-clippers-set-trimmer-pedicure-care-clip-p-20018.html,€7.61,€18.70 
Fm Transmitter Car MP3 Player LED Blue Screen Bluetooth FM Transmitter,https://www.cigabuy.com/fm-transmitter-car-mp3-player-led-blue-screen-bluetooth-fm-transmitter-p-18659.html,,
QCY T6 TWS Bluetooth 5.0 in-ear Touch control Headset with Microphone,https://www.cigabuy.com/qcy-t6-tws-bluetooth-50-in-ear-touch-control-headset-with-microphone-p-18995.html,€19.90,€46.58 
E27 12V 7W Natural White Intelligent Emergency LED Light Bulbs,https://www.cigabuy.com/e27-12v-7w-natural-white-intelligent-emergency-led-light-bulbs-p-17582.html,,
Wireless Bluetooth Headset Handsfree Driving Sport Over-Ear Earphone,https://www.cigabuy.com/wireless-bluetooth-headset-handsfree-driving-sport-over-ear-earphone-p-18720.html,€5.97,€7.24 
C6T Body Temperature Smart Bracelet Watch IP67 Heart Rate Monitor Wristband,https://www.cigabuy.com/c6t-body-temperature-smart-bracelet-watch-ip67-heart-rate-monitor-wristband-p-18787.html,€12.67,€21.33 
Men Watches Auto Date Chronograph Quartz Watch Sport Strap Watch,https://www.cigabuy.com/men-watches-auto-date-chronograph-quartz-watch-sport-strap-watch-p-19241.html,€2.64,€6.36 
Stainless Steel Case Leather Band Watch Quartz Business Men Wristwatch Casual,https://www.cigabuy.com/stainless-steel-case-leather-band-watch-quartz-business-men-wristwatch-casual-p-19733.html,,
L11 Bluetooth 5.0 TWS Earphones with Charging Case,https://www.cigabuy.com/l11-bluetooth-50-tws-earphones-with-charging-case-p-19809.html,,
IDO ID107 Smart Bracelet Heart Rate Monitor Call Reminder Pedometer,https://www.cigabuy.com/ido-id107-smart-bracelet-heart-rate-monitor-call-reminder-pedometer-p-19822.html,,
i7 TWS Bluetooth V4.1 Earphones with Charging Case,https://www.cigabuy.com/i7-tws-bluetooth-v41-earphones-with-charging-case-p-19828.html,,
Men Backpack Waterproof Travel Bag Capacity Male Mochila Teenager Backpacks,https://www.cigabuy.com/men-backpack-waterproof-travel-bag-capacity-male-mochila-teenager-backpacks-p-18658.html,,
10m DIY Automatic Drip & Micro Sprinkler Kit Plant Garden Irrigation System,https://www.cigabuy.com/10m-diy-automatic-drip-micro-sprinkler-kit-plant-garden-irrigation-system-p-17566.html,,
Honeybee String Lights 2.2M 20-LED Led String Lights for Outdoor Xmas Decoration,https://www.cigabuy.com/honeybee-string-lights-22m-20-led-led-string-lights-for-outdoor-xmas-decoration-p-17590.html,,
Sothing Mosquito Swatter Portable Rechargeable Electric Mosquito Killer,https://www.cigabuy.com/sothing-mosquito-swatter-portable-rechargeable-electric-mosquito-killer-p-18666.html,,
Retractable Dog Leash Durable Reflective Nylon Dog Lead For Small Medium Dogs,https://www.cigabuy.com/retractable-dog-leash-durable-reflective-nylon-dog-lead-for-small-medium-dogs-p-14240.html,€2.47,€15.17 
Baellerry Men PU Leather Functional Long Wallet Vintage Purse Clutch Bag,https://www.cigabuy.com/baellerry-men-pu-leather-functional-long-wallet-vintage-purse-clutch-bag-p-18920.html,€3.41,€12.42 
MEGIR 2028G Men Watch Quartz Leather Watch,https://www.cigabuy.com/megir-2028g-men-watch-quartz-leather-watch-p-18781.html,€10.86,€23.14 
FONGE R6 Heavy Bass Earphone 3.5mm Jack Stereo Music Headphone with Mic,https://www.cigabuy.com/fonge-r6-heavy-bass-earphone-35mm-jack-stereo-music-headphone-with-mic-p-19788.html,,
ESTRELLA  64G USB2.0 High Speed Mini Flash Drive Waterproof USB,https://www.cigabuy.com/estrella-64g-usb20-high-speed-mini-flash-drive-waterproof-usb-p-17570.html,,
YWXLight Solar LED Lamp Bear Claw Lamp Garden Lights Outdoor Landscape Lighting,https://www.cigabuy.com/ywxlight-solar-led-lamp-bear-claw-lamp-garden-lights-outdoor-landscape-lighting-p-17591.html,,
Non-Stick Grill BBQ Standing Rib Rack Stainless Steel Roasting Rack,https://www.cigabuy.com/non-stick-grill-bbq-standing-rib-rack-stainless-steel-roasting-rack-p-17542.html,,
In Ear/ Earhook Style Earphones Sweat-Resistant Sports Earphone Earbuds w/ Mic,https://www.cigabuy.com/in-ear-earhook-style-earphones-sweat-resistant-sports-earphone-earbuds-w-mic-p-19782.html,,
NAVIFORCE Men Sports Watches Military Digital Chronograph Quartz Wristwatch,https://www.cigabuy.com/naviforce-men-sports-watches-military-digital-chronograph-quartz-wristwatch-p-18923.html,€15.02,€26.60 
ROSIVGA Fashion Quartz Wrist Watch with PU Letecher for Men,https://www.cigabuy.com/rosivga-fashion-quartz-wrist-watch-with-pu-letecher-for-men-p-19754.html,,
NAVIFORCE 3004 Luxury Analog sports Wristwatch Display Date Men Quartz Watch,https://www.cigabuy.com/naviforce-3004-luxury-analog-sports-wristwatch-display-date-men-quartz-watch-p-19220.html,€14.00,€34.06 
Racing RC Car Vehicle Models 60km/h RC Car 550 Motor Off-Road Car,https://www.cigabuy.com/racing-rc-car-vehicle-models-60kmh-rc-car-550-motor-off-road-car-p-19250.html,€58.59,€158.86 
V5.0 Bluetooth Earphones Sport Hifi Headphones Wireless Ear Hook,https://www.cigabuy.com/v50-bluetooth-earphones-sport-hifi-headphones-wireless-ear-hook-p-18987.html,€10.34,€15.61 
1/2/4 pcs EU Plug Digital Display Energy Saving Timer Programmable Timer Socket,https://www.cigabuy.com/124-pcs-eu-plug-digital-display-energy-saving-timer-programmable-timer-socket-p-17563.html,,
Mini Portable Ultrasonic Pulsator Turbo Washing Machine,https://www.cigabuy.com/mini-portable-ultrasonic-pulsator-turbo-washing-machine-p-18709.html,€13.58,€23.54 
USB Rechargeable Flashlight Portable Lantern Waterproof Flash Light,https://www.cigabuy.com/usb-rechargeable-flashlight-portable-lantern-waterproof-flash-light-p-18834.html,€3.34,€6.68 
Men PU Leather Long Clutch Wallet Business Men Cards Phone Holder Purse,https://www.cigabuy.com/men-pu-leather-long-clutch-wallet-business-men-cards-phone-holder-purse-p-19000.html,€4.76,€16.65 
WEIXIER Long Men Wallet Double Zipper Coin Pocket Purse Casual Card Holder,https://www.cigabuy.com/weixier-long-men-wallet-double-zipper-coin-pocket-purse-casual-card-holder-p-19219.html,€4.63,€17.81 
New Smartwatch Zeblaze Crystal 3 IP67 Long Standby IPS Display Smart Watch,https://www.cigabuy.com/new-smartwatch-zeblaze-crystal-3-ip67-long-standby-ips-display-smart-watch-p-19232.html,€13.64,€27.30 
Smart Wireless Bluetooth Stereo Headset Headphone with MIC,https://www.cigabuy.com/smart-wireless-bluetooth-stereo-headset-headphone-with-mic-p-19314.html,€8.48,€22.14 
X23 Earphone Car Single Ear Can Talk Wireless Bluetooth Headset Hanging,https://www.cigabuy.com/x23-earphone-car-single-ear-can-talk-wireless-bluetooth-headset-hanging-p-19320.html,€4.19,€11.38 
Ball Bluetooth Speaker Wireless Mini Speaker Subwoofer FM Multicolored Ball,https://www.cigabuy.com/ball-bluetooth-speaker-wireless-mini-speaker-subwoofer-fm-multicolored-ball-p-19416.html,€9.38,€24.80 
Crrju Fashion Mens Watches Top Brand Luxury Quartz Watch Men,https://www.cigabuy.com/crrju-fashion-mens-watches-top-brand-luxury-quartz-watch-men-p-19728.html,,
TC16 Type-c Earphone Stereo Line Control In-Ear Hands Free Call f LeEco Xiaomi,https://www.cigabuy.com/tc16-type-earphone-stereo-line-control-in-ear-hands-free-call-f-leeco-xiaomi-p-19772.html,,
Magnetic Wireless Earbuds,https://www.cigabuy.com/magnetic-wireless-earbuds-p-19786.html,,
Wowstick 42 in 1 Screwdriver Kit Portable Precision Multi-function Screwdriver,https://www.cigabuy.com/wowstick-42-in-1-screwdriver-kit-portable-precision-multi-function-screwdriver-p-18912.html,€27.07,€51.10 
XIAOMI MIJIA Microhoo Mini Air Conditioner Fan Personal Portable USB Air Cooler,https://www.cigabuy.com/xiaomi-mijia-microhoo-mini-air-conditioner-fan-personal-portable-usb-air-cooler-p-18924.html,€26.89,€64.24 
Xiaomi Turok Steinhardt TS Brand Polarized Stainless Mirror Lenses Sunglasses,https://www.cigabuy.com/xiaomi-turok-steinhardt-ts-brand-polarized-stainless-mirror-lenses-sunglasses-p-18913.html,€14.66,€30.31 
EAGET CU10 32GB Type-C to USB3.0 Metal OTG USB Flash Drive,https://www.cigabuy.com/eaget-cu10-32gb-type-to-usb30-metal-otg-usb-flash-drive-p-19760.html,,
Xiaomi Pizza Cutter Stainless Steel Cake Knife Pizza Wheels knife Removable,https://www.cigabuy.com/xiaomi-pizza-cutter-stainless-steel-cake-knife-pizza-wheels-knife-removable-p-19287.html,,
Mini Rechargeable U Disk Plastic Professional Voice Recorder Portable Audio Pen,https://www.cigabuy.com/mini-rechargeable-u-disk-plastic-professional-voice-recorder-portable-audio-pen-p-19019.html,€3.23,€5.19 
Smart Bracelet Watch Fitness Bracelet Pedometer Heart Rate Monitor Waterproof,https://www.cigabuy.com/smart-bracelet-watch-fitness-bracelet-pedometer-heart-rate-monitor-waterproof-p-19737.html,,
Waist Bag Fashion Chest Pack Outdoor Sports Crossbody Bag Casual Travel Bag,https://www.cigabuy.com/waist-bag-fashion-chest-pack-outdoor-sports-crossbody-bag-casual-travel-bag-p-19184.html,€3.74,€16.24 
BOAMIGO Men Quartz Watches 3 time zone creative LED Digital Sports Watches,https://www.cigabuy.com/boamigo-men-quartz-watches-3-time-zone-creative-led-digital-sports-watches-p-19207.html,€12.30,€22.07 
PU Leather Backpack Youth Travel Rucksack School Laptop Business Shoulder Bags,https://www.cigabuy.com/pu-leather-backpack-youth-travel-rucksack-school-laptop-business-shoulder-bags-p-19182.html,€10.43,€54.36 
S03 Smart Watch Waterproof Activity Tracker Smart Band Bracelet,https://www.cigabuy.com/s03-smart-watch-waterproof-activity-tracker-smart-band-bracelet-p-19736.html,,
K08 Wireless Headphone Bluetooth5.0 Bone Conduction Headsets Wireless,https://www.cigabuy.com/k08-wireless-headphone-bluetooth50-bone-conduction-headsets-wireless-p-19739.html,,
ELECAM Explorer Pro 4K@24fps NTK96660 Wi-Fi 12MP Sports Camera,https://www.cigabuy.com/elecam-explorer-pro-4k24fps-ntk96660-wi-fi-12mp-sports-camera-p-19742.html,,
Genuine Leather Men Key Wallet Male Car Key Bag Keys Capacity Small Wallets,https://www.cigabuy.com/genuine-leather-men-key-wallet-male-car-key-bag-keys-capacity-small-wallets-p-19229.html,€4.81,€16.11 
Strap Bracelet Metal Wristband Xiaomi Mi Band 3 xiaomi Smart Accessories,https://www.cigabuy.com/strap-bracelet-metal-wristband-xiaomi-mi-band-3-xiaomi-smart-accessories-p-18655.html,,
YL-6S Wireless Bluetooth Earphone In-ear Earbuds Waterproof HD Call Headset,https://www.cigabuy.com/yl-6s-wireless-bluetooth-earphone-in-ear-earbuds-waterproof-hd-call-headset-p-18835.html,€6.87,€13.75 
Wireless Mouse Vertical Mouse Ergonomic Optical 2400 DPI 6 Buttons Mause,https://www.cigabuy.com/wireless-mouse-vertical-mouse-ergonomic-optical-2400-dpi-6-buttons-mause-p-18844.html,€7.78,€15.56 
Xiaomi mijia yunmai Wrist ball Trainer LED Gyroball Essential Spinner,https://www.cigabuy.com/xiaomi-mijia-yunmai-wrist-ball-trainer-led-gyroball-essential-spinner-p-18922.html,€7.46,€22.91 
T9S TWS 5.0 Bluetooth Earphone Wireless Earbuds Magnetic Stereo Sound In-ear,https://www.cigabuy.com/t9s-tws-50-bluetooth-earphone-wireless-earbuds-magnetic-stereo-sound-in-ear-p-19002.html,€11.96,€18.68 
Business Large Men Travel bags Handbag Briefcase PU Leather Laptop Bag,https://www.cigabuy.com/business-large-men-travel-bags-handbag-briefcase-pu-leather-laptop-bag-p-19030.html,€8.81,€62.47 
NAVIFORCE 9093 Luxury Men Military Sport Watches Digital Quartz Clock,https://www.cigabuy.com/naviforce-9093-luxury-men-military-sport-watches-digital-quartz-clock-p-19198.html,€14.17,€27.60 
Printing Pen 12V 3D Pen Pencil 3D Drawing Pen Filament For Kid Education,https://www.cigabuy.com/printing-pen-12v-3d-pen-pencil-3d-drawing-pen-filament-for-kid-education-p-19316.html,€7.40,€22.08 
Mini Bluetooth Earbud 6 Hour Playtime Car Headset with Mic for iPhone,https://www.cigabuy.com/mini-bluetooth-earbud-6-hour-playtime-car-headset-with-mic-for-iphone-p-19725.html,,
Bluetooth Headphone Kissral Wireless Sport Earbud,https://www.cigabuy.com/bluetooth-headphone-kissral-wireless-sport-earbud-p-19727.html,,
T10 Bluetooth Headsets Wireless Earbuds 5.0 TWS Earphone,https://www.cigabuy.com/t10-bluetooth-headsets-wireless-earbuds-50-tws-earphone-p-19735.html,,
Original Xiaomi Piston Basic Edition In-ear Headset Earphone w/ Mic,https://www.cigabuy.com/original-xiaomi-piston-basic-edition-in-ear-headset-earphone-w-mic-p-19823.html,,
E6 Bluetooth Earphone 4.2 In-Ear MINI Stereo 600mA with Charging Box,https://www.cigabuy.com/e6-bluetooth-earphone-42-in-ear-mini-stereo-600ma-with-charging-box-p-19829.html,,
5pcs G4 12-24V 6W 600LM 2-LED COB LED Light Bulbs,https://www.cigabuy.com/5pcs-g4-12-24v-6w-600lm-2-led-cob-led-light-bulbs-p-19900.html,,
Dacom K6P Mini Smart Wireless Bluetooth Earbuds With Microphone,https://www.cigabuy.com/dacom-k6p-mini-smart-wireless-bluetooth-earbuds-with-microphone-p-19042.html,€7.46,€15.20 
Men Wallets Large Capacity Zipper Hasp Quality PU Leather Wallet,https://www.cigabuy.com/men-wallets-large-capacity-zipper-hasp-quality-pu-leather-wallet-p-18660.html,,
